{
  "$schema": "./schema.json",
  "id": "nation-ayashi",
  "name": "Nation Ayashi",
  "subtitle": "Restaurant japonais · Formule à volonté",
  "accent": "#d6247a",
  "info": {
    "address": "20 cours de Vincennes, 75012 Paris",
    "phone": "+33 1 43 45 88 78",
    "website": "https://nationayashi.fr",
    "hours": [
      { "days": [2, 3, 4, 5, 6], "slots": [["11:30", "14:30"], ["18:30", "22:30"]] },
      { "days": [0], "slots": [["11:30", "14:30"], ["18:30", "22:00"]] }
    ],
    "services": ["Sur place", "À emporter", "Livraison"],
    "notes": [
      "La formule à volonté est réservée à la consommation sur place.",
      "Tarif enfant jusqu'à 10 ans, gratuit pour les moins de 2 ans.",
      "Le tarif du soir s'applique aussi le samedi, le dimanche et les jours fériés.",
      "Allergènes, moyens de paiement, réservation : renseignez-vous auprès du restaurant."
    ]
  },
  "favorites": ["06", "30", "50", "40", "55", "17"],
  "rules": {
    "maxPerRound": 5,
    "limitByDefault": false,
    "wastePenalty": 5,
    "note": "Commandez par tournées, autant de fois que vous le souhaitez. Le restaurant demande en principe 5 numéros maximum par personne et par tournée : l'hôte peut activer cette limite dans l'onglet Table. Pour éviter le gâchis, 5 € par portion non consommée."
  },
  "periods": [
    {
      "id": "midi",
      "label": "Midi",
      "hint": "Mardi–vendredi midi, hors jours fériés",
      "schedule": { "days": [2, 3, 4, 5], "from": "11:00", "to": "15:30" },
      "prices": { "adulte": 15.9, "enfant": 10.9, "bebe": 0 }
    },
    {
      "id": "soir",
      "label": "Soir & week-end",
      "hint": "Tous les soirs, samedi, dimanche et jours fériés",
      "prices": { "adulte": 20.9, "enfant": 16.9, "bebe": 0 }
    }
  ],
  "guests": [
    { "id": "adulte", "label": "Adulte" },
    { "id": "enfant", "label": "Enfant (−10 ans)" },
    { "id": "bebe", "label": "Bébé (−2 ans)" }
  ],
  "categories": [
    { "id": "entrees", "name": "Entrées & accompagnements", "short": "Entrées", "icon": "🥟" },
    { "id": "soupes", "name": "Soupes nouilles", "icon": "🍜" },
    { "id": "maki", "name": "Maki", "icon": "🍣", "note": "Servis par 6 pièces" },
    { "id": "sushi", "name": "Sushi", "icon": "🍙", "note": "Servis par 2" },
    { "id": "yakitori", "name": "Yakitori", "icon": "🍢", "note": "Servis par paire" },
    { "id": "sashimi", "name": "Sashimi & dessert", "short": "Sashimi", "icon": "🐟", "note": "Avec supplément" },
    { "id": "soir", "name": "Le soir, le week-end et les jours fériés", "short": "Soir & week-end", "icon": "🌙", "periods": ["soir"] },
    { "id": "aperitifs", "name": "Apéritifs", "icon": "🍸", "extra": true },
    { "id": "vins", "name": "Vins", "icon": "🍷", "extra": true },
    { "id": "boissons", "name": "Boissons", "icon": "🥤", "extra": true },
    { "id": "digestifs", "name": "Chauds & digestifs", "icon": "🍵", "extra": true }
  ],
  "items": [
    { "n": "01", "cat": "entrees", "name": "Soupe miso", "icon": "🥣" },
    { "n": "02", "cat": "entrees", "name": "Salade de chou", "icon": "🥗" },
    { "n": "03", "cat": "entrees", "name": "Nuggets de poulet", "icon": "🍗", "pcs": "2 pièces" },
    { "n": "04", "cat": "entrees", "name": "Ailes de poulet croustillantes", "icon": "🍗", "pcs": "2 pièces" },
    { "n": "05", "cat": "entrees", "name": "Crêpes de pomme de terre", "icon": "🥔", "pcs": "2 pièces" },
    { "n": "06", "cat": "entrees", "name": "Gyoza au poulet", "icon": "🥟", "pcs": "2 pièces" },
    { "n": "07", "cat": "entrees", "name": "Riz nature", "icon": "🍚" },
    { "n": "08", "cat": "entrees", "name": "Riz vinaigré", "icon": "🍚" },
    { "n": "09", "cat": "entrees", "name": "Samoussa bœuf", "icon": "🥟", "pcs": "2 pièces" },
    { "n": "10", "cat": "entrees", "name": "Nems poulet", "icon": "🌯🍗", "pcs": "2 pièces" },
    { "n": "11", "cat": "entrees", "name": "Nems légumes", "icon": "🌯🥦", "pcs": "2 pièces" },
    { "n": "12", "cat": "entrees", "name": "Nems crevettes", "icon": "🌯🦐", "pcs": "2 pièces" },
    { "n": "13", "cat": "entrees", "name": "Beignets de calamars", "icon": "🦑", "pcs": "2 pièces" },
    { "n": "14", "cat": "entrees", "name": "Beignets de fromage", "icon": "🧀", "pcs": "2 pièces" },
    { "n": "15", "cat": "entrees", "name": "Riz sauté aux légumes", "icon": "🍚🥦" },
    { "n": "16", "cat": "entrees", "name": "Nouilles sautées aux légumes", "icon": "🍝🥦" },
    { "n": "17", "cat": "entrees", "name": "Shaké-don", "icon": "🍚🐟", "desc": "Tranches de saumon sur un bol de riz vinaigré" },
    { "n": "18", "cat": "entrees", "name": "Bœuf oignon", "icon": "🍚🥩", "desc": "Sur un bol de riz" },
    { "n": "19", "cat": "entrees", "name": "Poulet sauté", "icon": "🍚🍗", "desc": "Sur un bol de riz" },
    { "n": "20", "cat": "entrees", "name": "California frit", "icon": "🍤", "pcs": "6 pièces" },

    { "n": "S1", "cat": "soupes", "name": "Soupe nouilles au poulet", "icon": "🍜🍗" },
    { "n": "S2", "cat": "soupes", "name": "Soupe nouilles au bœuf", "icon": "🍜🥩" },
    { "n": "S3", "cat": "soupes", "name": "Soupe nouilles aux légumes", "icon": "🍜🥦" },
    { "n": "S5", "cat": "soupes", "name": "Soupe nouilles aux crevettes", "icon": "🍜🦐", "periods": ["soir"] },

    { "n": "21", "cat": "maki", "name": "Tekka maki", "icon": "🍣🐟", "desc": "Thon" },
    { "n": "22", "cat": "maki", "name": "Shaké maki", "icon": "🍣🐟", "desc": "Saumon" },
    { "n": "23", "cat": "maki", "name": "Maki crevette", "icon": "🍣🦐" },
    { "n": "24", "cat": "maki", "name": "Kappa maki", "icon": "🍣🥒", "desc": "Concombre" },
    { "n": "25", "cat": "maki", "name": "Avocado maki", "icon": "🍣🥑", "desc": "Avocat" },
    { "n": "26", "cat": "maki", "name": "Oshinko maki", "icon": "🍣", "desc": "Radis salé" },
    { "n": "27", "cat": "maki", "name": "Maki fromage", "icon": "🍣🧀" },
    { "n": "28", "cat": "maki", "name": "Maki thon cuit", "icon": "🍣🐟" },
    { "n": "29", "cat": "maki", "name": "California thon avocat", "icon": "🍣🥑" },
    { "n": "30", "cat": "maki", "name": "California saumon avocat", "icon": "🍣🥑" },
    { "n": "31", "cat": "maki", "name": "California avocat crevette", "icon": "🍣🦐" },
    { "n": "32", "cat": "maki", "name": "California avocat surimi", "icon": "🍣🦀" },
    { "n": "33", "cat": "maki", "name": "California poulet épicé", "icon": "🍣🌶️" },
    { "n": "34", "cat": "maki", "name": "California thon cuit avocat", "icon": "🍣🥑" },
    { "n": "35", "cat": "maki", "name": "California concombre cheese", "icon": "🍣🧀" },
    { "n": "36", "cat": "maki", "name": "Las Vegas", "icon": "🍣" },
    { "n": "37", "cat": "maki", "name": "Printemps saumon avocat", "icon": "🍣🥑" },
    { "n": "38", "cat": "maki", "name": "Printemps fromage concombre", "icon": "🍣🧀" },
    { "n": "39", "cat": "maki", "name": "Neige thon avocat", "icon": "🍣🥑" },
    { "n": "40", "cat": "maki", "name": "Neige saumon avocat", "icon": "🍣🥑" },
    { "n": "41", "cat": "maki", "name": "Neige fromage concombre", "icon": "🍣🧀" },
    { "n": "42", "cat": "maki", "name": "Neige saumon fromage", "icon": "🍣🧀" },
    { "n": "43", "cat": "maki", "name": "Neige fromage", "icon": "🍣🧀" },
    { "n": "44", "cat": "maki", "name": "Neige thon cuit avocat", "icon": "🍣🥑" },
    { "n": "45", "cat": "maki", "name": "Oignon frit saumon avocat", "icon": "🍣🥑" },
    { "n": "46", "cat": "maki", "name": "Oignon frit thon cuit avocat", "icon": "🍣🥑" },
    { "n": "47", "cat": "maki", "name": "California saumon cheese", "icon": "🍣🧀" },
    { "n": "48", "cat": "maki", "name": "Temaki saumon avocat", "icon": "🍣🥑", "pcs": "1 pièce" },

    { "n": "49", "cat": "sushi", "name": "Maguro", "icon": "🍣🐟", "desc": "Thon" },
    { "n": "50", "cat": "sushi", "name": "Shaké", "icon": "🍣🐟", "desc": "Saumon" },
    { "n": "51", "cat": "sushi", "name": "Tai", "icon": "🍣🐟", "desc": "Daurade" },
    { "n": "52", "cat": "sushi", "name": "Saba", "icon": "🍣🐟", "desc": "Maquereau" },
    { "n": "53", "cat": "sushi", "name": "Ebi", "icon": "🍣🦐", "desc": "Crevette" },
    { "n": "54", "cat": "sushi", "name": "Saumon fromage", "icon": "🍣🧀" },

    { "n": "55", "cat": "yakitori", "name": "Negima", "icon": "🍢🍗", "desc": "Poulet" },
    { "n": "56", "cat": "yakitori", "name": "Tsukune", "icon": "🍢🍗", "desc": "Boulettes de poulet" },
    { "n": "57", "cat": "yakitori", "name": "Teba", "icon": "🍢🍗", "desc": "Ailes de poulet" },
    { "n": "58", "cat": "yakitori", "name": "Gyuniku", "icon": "🍢🥩", "desc": "Bœuf" },
    { "n": "59", "cat": "yakitori", "name": "Cheese yaki", "icon": "🍢🧀", "desc": "Bœuf au fromage" },
    { "n": "60", "cat": "yakitori", "name": "Kinoko", "icon": "🍢🍄", "desc": "Champignons" },

    { "n": "61", "cat": "sashimi", "name": "Sashimi shaké", "icon": "🐟", "desc": "Saumon", "pcs": "5 tranches", "price": 5 },
    { "n": "62", "cat": "sashimi", "name": "Dessert du jour", "icon": "🍰", "price": 2 },

    { "n": "63", "cat": "soir", "name": "Yakitori shaké", "icon": "🍢🐟", "desc": "Saumon", "pcs": "2 pièces" },
    { "n": "64", "cat": "soir", "name": "Yakitori maguro", "icon": "🍢🐟", "desc": "Thon", "pcs": "2 pièces" },
    { "n": "65", "cat": "soir", "name": "Brochettes de crevettes", "icon": "🍢🦐" },
    { "n": "66", "cat": "soir", "name": "Masago", "icon": "🍣🥚", "desc": "Œufs de lompe, saumon avocat", "pcs": "6 pièces" },
    { "n": "67", "cat": "soir", "name": "Oignon frit avocat fromage", "icon": "🍣🧀", "pcs": "6 pièces" },
    { "n": "68", "cat": "soir", "name": "Ebi tempura maki", "icon": "🍣🍤", "pcs": "6 pièces" },
    { "n": "69", "cat": "soir", "name": "California aneth saumon cheese", "icon": "🍣🌿", "pcs": "6 pièces" },
    { "n": "70", "cat": "soir", "name": "California roquette cheese", "icon": "🍣🥬", "pcs": "6 pièces" },
    { "n": "71", "cat": "soir", "name": "Mayo roll", "icon": "🍣🥑", "desc": "Saumon avocat cheese mayo", "pcs": "6 pièces" },
    { "n": "72", "cat": "soir", "name": "Oignon frit saumon cheese", "icon": "🍣🧀", "pcs": "6 pièces" },
    { "n": "73", "cat": "soir", "name": "Sushi saumon avocat", "icon": "🍣🥑", "pcs": "2 pièces" },